{
  "manifest_type": "kg_artifact_lineage",
  "manifest_version": 3,
  "created_at_utc": "2026-07-13T19:21:17Z",
  "git_revision": "5a2e6eaae0ed8cb72bf517d931fb7764a810066a",
  "artifacts": {
    "stage0": {
      "path": "/home/wucloud/kg-benchmark/data/00_entity_popularity.json",
      "size_bytes": 272797007,
      "sha256": "704fba361c9701bd19433a9fe163892aa753d7665c1580497dc0045f79c1c965",
      "record_count": 495849
    },
    "stage1": {
      "path": "/home/wucloud/kg-benchmark/data/01_repair_candidates.json",
      "size_bytes": 408404336,
      "sha256": "0ae540c6589cb5aea808b2b95623b8f67d60644e01690470ae2ed59fad66a2e1",
      "record_count": 1770757
    },
    "stage2_json": {
      "path": "/home/wucloud/kg-benchmark/data/02_wikidata_repairs.json",
      "size_bytes": 34516220272,
      "sha256": "7d7777358e27f7c8e8fa8df881192a600dc4c879c91a60b83c5161ad61259a3a",
      "record_count": 535570
    },
    "stage2_jsonl": {
      "path": "/home/wucloud/kg-benchmark/data/02_wikidata_repairs.jsonl",
      "size_bytes": 21549328765,
      "sha256": "5119840b548ace231b716603957a4a413b6fd2e13f5e1353200f708c988252b3",
      "record_count": 544178
    },
    "stage3": {
      "path": "/home/wucloud/kg-benchmark/data/03_world_state.json",
      "size_bytes": 20523499701,
      "sha256": "7e3591a9bfc7289c698d1cc87339604b3c796a042d8ce96bb0d67f435bfa21bf",
      "record_count": 535570
    },
    "stage4": {
      "path": "/home/wucloud/kg-benchmark/data/04_classified_benchmark.jsonl",
      "size_bytes": 4766019365,
      "sha256": "dfbdc9286cc54e10dfe7092ecdf78f95e9852b9271c564b3dfa2447b4487f344",
      "record_count": 535570
    }
  },
  "source_provenance": [
    {
      "source_type": "restored_workspace_artifacts",
      "status": "exact_upstream_snapshot_unresolved",
      "recovery_date_utc": "2026-07-13",
      "statement": "These immutable local artifacts predate the confirmatory freeze work. No upstream URL, retrieval timestamp, or source snapshot identifier is inferred. Their exact bytes are bound by the lineage manifest.",
      "stage0_sha256": "704fba361c9701bd19433a9fe163892aa753d7665c1580497dc0045f79c1c965",
      "stage1_sha256": "0ae540c6589cb5aea808b2b95623b8f67d60644e01690470ae2ed59fad66a2e1",
      "stage2_json_sha256": "7d7777358e27f7c8e8fa8df881192a600dc4c879c91a60b83c5161ad61259a3a",
      "stage2_jsonl_sha256": "5119840b548ace231b716603957a4a413b6fd2e13f5e1353200f708c988252b3",
      "stage3_sha256": "7e3591a9bfc7289c698d1cc87339604b3c796a042d8ce96bb0d67f435bfa21bf",
      "stage4_sha256": "dfbdc9286cc54e10dfe7092ecdf78f95e9852b9271c564b3dfa2447b4487f344"
    }
  ],
  "validation": {
    "passed": true,
    "authoritative_stage2_artifact": "stage2_json",
    "stage2_relationship": {
      "mode": "ordered_filtered_enriched_successor",
      "passed": true,
      "checks": {
        "ids_complete": true,
        "ids_unique": true,
        "authoritative_ids_are_precursor_subset": true,
        "authoritative_order_is_precursor_subsequence": true,
        "shared_records_equal_after_declared_enrichment_removed": true,
        "declared_enrichment_absent_from_precursor": true,
        "precursor_only_records_explicitly_allowed": true,
        "precursor_jsonl_format_explained": true,
        "declared_artifact_hashes_match": true
      },
      "counts": {
        "authoritative": 535570,
        "precursor": 544178,
        "precursor_physical_lines": 544177,
        "shared": 535570,
        "precursor_only": 8608
      },
      "declared_transform": {
        "authoritative_artifact": "stage2_json",
        "precursor_artifact": "stage2_jsonl",
        "allowed_authoritative_only_fields": [
          "popularity"
        ],
        "allow_precursor_only_records": true,
        "allow_precursor_jsonl_multi_value_lines": true,
        "expected_artifact_sha256": {
          "stage2_json": "7d7777358e27f7c8e8fa8df881192a600dc4c879c91a60b83c5161ad61259a3a",
          "stage2_jsonl": "5119840b548ace231b716603957a4a413b6fd2e13f5e1353200f708c988252b3"
        }
      },
      "enrichment_field_presence_counts": {
        "popularity": 535570
      },
      "precursor_only_ids_sha256": "6f7df496caf7ee5c8ad19a421c078e69506abeee997f229bbb39377e954b5791",
      "differences": {
        "authoritative_missing_from_precursor": [],
        "shared_content_mismatches": [],
        "ordering": [],
        "declared_fields_present_in_precursor": [],
        "precursor_only_sample": [
          "repair_Q131564796_2399916572",
          "reform_Q3563482_P242_1687213130",
          "repair_Q125624182_2440645211",
          "repair_Q125412748_2277917911",
          "repair_Q125412176_2277925312",
          "repair_Q107414628_2420567967",
          "repair_Q132957929_2444873071",
          "repair_Q125410974_2277903881",
          "repair_Q135233194_2428378788",
          "repair_Q125413144_2277900573",
          "repair_Q125409914_2277921021",
          "repair_Q125412915_2277919826",
          "repair_Q136764863_2442386771",
          "repair_Q60848239_2439763805",
          "repair_Q125414150_2277901240",
          "reform_Q28008270_P2521_1725922197",
          "repair_Q125412846_2277919618",
          "repair_Q136767733_2442386651",
          "repair_Q125410264_2277901310",
          "repair_Q125413481_2277923271",
          "reform_Q7676662_P400_2356390580",
          "repair_Q125410230_2277899785",
          "repair_Q125413262_2277902716",
          "reform_Q107438407_P2092_2333296438",
          "repair_Q125412090_2277924110",
          "repair_Q125410689_2277892847",
          "repair_Q125413613_2277924957",
          "repair_Q125412072_2277909239",
          "repair_Q125411244_2277893337",
          "repair_Q125411207_2277923445",
          "repair_Q125413382_2277909472",
          "repair_Q136758877_2442385724",
          "repair_Q125412442_2277909905",
          "repair_Q125412359_2277922904",
          "reform_Q54821280_P957_1774652896",
          "repair_Q107415362_2433924761",
          "repair_Q136763527_2442386393",
          "repair_Q83495551_2033546910",
          "repair_Q136795673_2445710934",
          "repair_Q74181037_2092022683",
          "repair_Q125410907_2277903777",
          "repair_Q125410310_2277896542",
          "reform_Q15964334_P828_1456089230",
          "repair_Q137343426_2442112672",
          "repair_Q125413636_2277924752",
          "reform_Q84359481_P1651_1713429147",
          "repair_Q26898278_2441214727",
          "repair_Q125411501_2277901662",
          "repair_Q133144814_2445320351",
          "reform_Q107445456_P2092_2333296438",
          "repair_Q125411740_2277895002",
          "repair_Q125410830_2277905771",
          "reform_Q84359451_P1651_1713429147",
          "repair_Q125412553_2277925099",
          "repair_Q125410050_2277893566",
          "repair_Q135233259_2428378276",
          "repair_Q136762606_2442386110",
          "repair_Q125408900_2277896908",
          "repair_Q136791975_2443820947",
          "repair_Q125410742_2277896646",
          "repair_Q137204770_2440047756",
          "repair_Q125413868_2277900297",
          "repair_Q125416263_2277918873",
          "repair_Q125414709_2277920337",
          "repair_Q136758875_2442385605",
          "repair_Q125409540_2277896047",
          "repair_Q115305312_2423537564",
          "repair_Q125412610_2277924572",
          "repair_Q125413145_2277926068",
          "repair_Q136767821_2442386747",
          "repair_Q125414555_2277922463",
          "repair_Q137401972_2447357299",
          "repair_Q125409021_2277894657",
          "repair_Q125411313_2277905275",
          "repair_Q125414315_2277919053",
          "reform_Q19035203_P645_696618524",
          "repair_Q136971422_2439731516",
          "repair_Q125410029_2277893004",
          "repair_Q136762172_2443861078",
          "repair_Q125414241_2277905447",
          "repair_Q113893487_1860955802",
          "repair_Q125411732_2277894967",
          "repair_Q136764681_2442386537",
          "repair_Q125411090_2277904238",
          "reform_Q44621248_P828_1456089230",
          "repair_Q125409940_2277921145",
          "repair_Q125409018_2277899102",
          "repair_Q137380392_2442332205",
          "repair_Q125410968_2277903814",
          "repair_Q55109937_2444948383",
          "repair_Q18775106_2428471291",
          "repair_Q125412317_2277897460",
          "reform_Q45417383_P166_2254793027",
          "repair_Q125411272_2277905107",
          "repair_Q125409201_2277895300",
          "repair_Q125413409_2277923652",
          "reform_Q113156753_P5800_1839493915",
          "repair_Q125413117_2277903444",
          "repair_Q125413333_2277897171",
          "repair_Q125414741_2277902518"
        ]
      },
      "missing_id_counts": {
        "authoritative": 0,
        "precursor": 0
      },
      "duplicate_ids": {
        "authoritative": [],
        "precursor": []
      }
    },
    "stage2_representation_equivalence": {
      "passed": false,
      "role": "diagnostic_only_when_stage2_relationship_mode_is_not_exact",
      "checks": {
        "counts_equal": false,
        "ids_complete": true,
        "ids_unique": true,
        "id_sets_equal": false,
        "ordering_equal": false,
        "canonical_record_digests_equal": false,
        "jsonl_one_record_per_line": false
      },
      "counts": {
        "json": 535570,
        "jsonl": 544178,
        "jsonl_physical_lines": 544177,
        "positions_compared": 535570
      },
      "differences": {
        "authoritative_missing_from_precursor": [],
        "shared_content_mismatches": [],
        "ordering": [],
        "declared_fields_present_in_precursor": [],
        "precursor_only_sample": [
          "repair_Q131564796_2399916572",
          "reform_Q3563482_P242_1687213130",
          "repair_Q125624182_2440645211",
          "repair_Q125412748_2277917911",
          "repair_Q125412176_2277925312",
          "repair_Q107414628_2420567967",